topic,query
religion,what is the state religion of [LOCATION] constitution?
religion,is [LOCATION] secular?
religion,how to change religion in [LOCATION]
religion,how many religious community coexist in [LOCATION]
religion,what is the significance of Ramadan in [LOCATION]
religion,What are the main religious festival of [LOCATION]
religion,how many national holidays in [LOCATION] based on religious festival
religion,Laws for converts in [LOCATION]
religion,Security for Atheists in [LOCATION]
religion,impacts of religious conversion on society
religion,some historical instances of religious conflict in [LOCATION]
sports,Most popular sports in [LOCATION]
sports,Top athletes of [LOCATION] in international sports
sports,Football clubs in [LOCATION]
sports,[LOCATION]'s performance in the Olympics
sports,what are the Traditional sports played in rural [LOCATION]?
sports,Development of women's sports in [LOCATION]
sports,Famous sports stadiums in [LOCATION]
sports,Achievements of [LOCATION] in field hockey
sports,Youth sports academies in [LOCATION]
sports,sports federations and organizations in [LOCATION]
sports,Top chess players in [LOCATION]
sports,[LOCATION] Chess Federation
sports,National game of [LOCATION]
sports,Top badminton players in [LOCATION]
sports,most popular indoor games of [LOCATION]
sports,Youth programs for indoor sports in [LOCATION]
sports,Fitness centers with indoor sports facilities in [LOCATION]
sports,Where to play squash in [LOCATION]
sports,Table tennis clubs and tournaments in [LOCATION]
sports,Popular indoor games in [LOCATION]
sports,History of indoor games in [LOCATION]
sports,Indoor sports facilities in [LOCATION]
tradition,How are weddings traditionally conducted in [LOCATION]?
tradition,What are the different types of traditional dresses worn in [LOCATION]?
tradition,traditional crafts and arts showcase
tradition,How do the indigenous communities in [LOCATION] celebrate their cultural festivals?
tradition,traditional rituals and ceremonies related to farming in rural [LOCATION]
tradition,tradition of oral poetry
tradition,What are the traditional games and sports played in rural [LOCATION]?
tradition,What traditional crafts and handicrafts are commonly produced in rural [LOCATION]?
tradition,What are the most significant UNESCO World Heritage Sites in [LOCATION]?
tradition,How does the traditional cuisine of [LOCATION] reflect its cultural heritage?
tradition,How is the art of traditional pottery making preserved in rural [LOCATION]?
tradition,What are the traditional dance forms in [LOCATION]?
tradition,How do traditional fishing practices reflect the heritage of coastal communities in [LOCATION]?
tradition,"Mud Architecture, traditional rural homes and buildings constructed from mud"
travel,ranking of tourism in [LOCATION]
travel,What are the things need to know before travelling in [LOCATION]
travel,is [LOCATION] safe for travel right now
travel,which countries visa free for [LOCATION]
travel,how do people travel various places in [LOCATION]
travel,is [LOCATION] safe to travel alone
travel,countries to travel with the passport of [LOCATION]
travel,tips on travelling in [LOCATION] alone
travel,how to get [LOCATION] tourist visa
travel,[LOCATION] pet passport and import regulations
travel,e visa online application system
travel,[LOCATION] travel restrictions
travel,[LOCATION] travel and tourism fair
travel,harassment at airport
travel,popular destinations in [LOCATION]
travel,[LOCATION] historical places
travel,best time to visit in [LOCATION]
travel,best hotels to stay in [LOCATION]
travel,condition of local transportation in [LOCATION]
travel,historical places of the capital city of [LOCATION]
travel,list of archaeological and sites in [LOCATION]
travel,safety of a solo female traveller in [LOCATION]
travel,Best accommodation for foreigner
travel,precaution to take with local food in [LOCATION]
travel,safety of train travels in [LOCATION]
travel,is it possible to travel [LOCATION] during monsoon
travel,requirements for getting a Visa on arrival in [LOCATION]
travel,contact details about [LOCATION] Visa on arrival
travel,is English widely understood in [LOCATION]
travel,tour packages in [LOCATION]
travel,best gifts to take from [LOCATION]
travel,information about domestic  flight [LOCATION]
travel,difficulties to get a SIM card for foreigner in [LOCATION]
travel,internet facilities in [LOCATION]
travel,major cities of [LOCATION]
travel,key tourist attraction of [LOCATION]
travel,how costly is [LOCATION] to visit
travel,what kind of transportation available in [LOCATION]
travel,money exchanger in [LOCATION]
travel,is ATM available in [LOCATION] airport
travel,most visited place of [LOCATION]
weather,what are Climate characteristics of [LOCATION]?
weather,Average winter temperature of [LOCATION]
weather,Average summer temperature of [LOCATION]
weather,Which month has the highest rainfall in [LOCATION]?
weather,what is the coldest month of [LOCATION]?
weather,Impact of climate change on [LOCATION]
weather,How does the monsoon season affect weather patterns in [LOCATION]?
weather,Harmful effects of climate change in [LOCATION]
weather,What are the typical rainfall patterns in different regions of [LOCATION]?
weather,How does [LOCATION] prepare for cyclone season and extreme weather events?
weather,most common natural disasters related to weather in [LOCATION]
weather,How does [LOCATION] monitor and predict weather events?
weather,Differences in weather between coastal and inland regions of [LOCATION]
weather,How do the seasons in [LOCATION] compare to those in other countries?
weather,average humidity levels throughout the year in [LOCATION]
weather,How does winter impact transportation and visibility in [LOCATION]?
weather,What are the temperature variations between day and night in [LOCATION]?
weather,How does weather impact agricultural productivity in [LOCATION]?
weather,What are the weather conditions for outdoor activities like hiking and trekking in [LOCATION]?
weather,What is the highest temperature record in [LOCATION] in one day?
weather,Summer time period in [LOCATION]
weather,which months are considered as moonson season of [LOCATION]?
weather,which months are winter season in [LOCATION]?
weather,What is the lowest temperature record in [LOCATION] in one day?
weather,What are the main seasons of [LOCATION]?
weather,How does weather impact the daily life of people living in rural areas of [LOCATION]?
weather,What are the best times of year to visit [LOCATION] based on weather conditions?
weather,How do weather patterns differ between the northern and southern regions of [LOCATION]?
weather,What are the typical wind speeds during different seasons in [LOCATION]?
weather,How does weather affect river levels and flooding in [LOCATION]?
weather,What are the risks of heatwaves in [LOCATION]?
weather,what are the necessary step are taken by people to manage heatwaves?
weather,How does weather impact energy consumption and electricity demand in [LOCATION]?
weather,weather-related health risks in [LOCATION]
weather,weather impact transportation infrastructure like roads and bridges in [LOCATION]
weather,What are the trends in extreme weather events like droughts and heatwaves in [LOCATION]?
weather,How does weather impact the fishing industry in coastal areas of [LOCATION]?
weather,weather conditions for birdwatching and wildlife safaris in [LOCATION]
weather,How does weather impact construction projects and infrastructure development in [LOCATION]?
weather,weather-related challenges for urban planning and development in [LOCATION]
weather,How does weather impact water availability and sanitation in [LOCATION]?
weather,What are the weather conditions for outdoor festivals and cultural events in [LOCATION]?
weather,weather impact for crop yields and food security in [LOCATION]
weather,How does weather impact the spread of vector-borne diseases like dengue and malaria in [LOCATION]?
weather,What are the weather-related risks for coastal communities in [LOCATION]?
weather,weather impact the availability of fresh water resources in [LOCATION]
weather,What are the weather conditions for beach tourism in [LOCATION]?
weather,pollution levels in [LOCATION]
weather,air quality of [LOCATION]
weather,weather impact for the timing and success of agricultural planting seasons in [LOCATION]
weather,How does weather impact soil erosion and land degradation in [LOCATION]?
weather,weather impact for the migration patterns of birds and wildlife in [LOCATION]
weather,weather-related risks for coastal agriculture and aquaculture in [LOCATION]
weather,How many Meteorological Departments are there in [LOCATION]?
weather,Which month is hottest in [LOCATION]?
weather,What is meant by monsoon climate?
weather,What is the reason for the change of seasons in [LOCATION]?
weather,Which country has similar climate to [LOCATION]?
weather,What is the potential damage to [LOCATION] due to sea level rise?
weather,What is the most important climate problem in [LOCATION]?
weather,What is the average annual rainfall of [LOCATION]?
weather,How does [LOCATION] prepare for and respond to cyclones?
weather,What are the most severe cyclones that have affected [LOCATION] in recent history?
weather,How does the government of [LOCATION] manage flood risks and mitigation efforts?