topic,query
animal,What is [LOCATION] State animal?
animal,What wild animal is in [LOCATION]?
animal,What is the symbol of the [LOCATION]?
animal,What animals are in [LOCATION] waters?
animal,What is the animal life in [LOCATION]?
animal,What is [LOCATION] State animal and why?
animal,How many animal shelters are in [LOCATION]?
animal,What is Animal Care Center in [LOCATION]?
animal,How much does it cost to adopt a dog in [LOCATION]?
animal,Are there any poisonous animals in [LOCATION]?
animal,What is the wildlife Unit [LOCATION] Parks?
animal,Who takes care of [LOCATION] parks?
animal,Does [LOCATION] have an aquarium?
animal,How many animals does the [LOCATION] Aquarium have?
animal,Does [LOCATION] aquarium have a free day?
animal,How long does it take to walk through the [LOCATION] Aquarium?
animal,Where to see whales near [LOCATION]?
animal,When to go whale watching on Long Island?
animal,What is the biggest zoo in [LOCATION]?
animal,Is there a free zoo in [LOCATION]?
animal,What is the pet rule in [LOCATION]?
animal,Is [LOCATION] a pet friendly city?
animal,Do [LOCATION] apartments allow pets?
animal,Are pet stores legal in [LOCATION]?
business,Is [LOCATION] a good city for business?
business,What business is [LOCATION] known for?
business,What is the business culture in [LOCATION]?
business,What is [LOCATION]'s biggest industry?
business,What is [LOCATION]'s main trade?
business,What trade makes the most money in [LOCATION]?
business,Are many Indian restaurants in [LOCATION] run by Bangladeshis?
business,What is the most successful business in [LOCATION]?
business,What is the largest finance company in [LOCATION]?
business,Why is [LOCATION] the financial capital of the world?
business,What percent of [LOCATION] works in finance?
business,What is [LOCATION] known for manufacturing?
business,What does [LOCATION] produce or manufacture?
business,What products are manufactured in [LOCATION] State?
business,Are there still factories in [LOCATION]?
business,What is the biggest industry in [LOCATION]?
business,What is [LOCATION]'s top export?
business,What is the famous brand from [LOCATION]?
business,Where was the first stock exchange in [LOCATION]?
business,What is the name of the stock exchange on Wall Street?
business,What are the largest banks headquartered in [LOCATION]?
business,What is the largest bank in the [LOCATION] by assets?
business,"Which [LOCATION]-based media conglomerate owns CNN, HBO, and Warner Bros.?"
business,Where are most startups located in [LOCATION]?
business,What is the largest business district in [LOCATION]?
business,What was the center of music publishing in [LOCATION]?
business,Who are the big five [LOCATION] publishers?
business,What is the name of the cancer center in [LOCATION]?
business,good cancer hospital in [LOCATION]?
business,Which [LOCATION] medical center is known for its pioneering work in heart transplants?
business,Which [LOCATION] street is famous for its concentration of jewelry stores?
business,How many street food vendors are there in [LOCATION]?
business,How many food establishments are there in [LOCATION]?
business,How many food carts are in [LOCATION]?
cloths,What is the fancy shopping street in [LOCATION]?
cloths,What part of [LOCATION] is best for shopping?
cloths,What happened to [LOCATION] and Company clothes?
cloths,Which [LOCATION] based fashion designer is famous for her stylish wedding gowns?
cloths,What is the most famous department store in [LOCATION]?
cloths,"Which department stores are famous for their big, medium, and small brown bags?"
cloths,What luxury department store brand is based in Midtown [LOCATION]?
cloths,What clothing brand has a polo player logo?
cloths,"Which iconic American fashion brand, founded in [LOCATION], is known for its polo player logo?"
cloths,What popular Japanese clothing retailer opened its first US store in [LOCATION]'s SoHo neighborhood?
cloths,"Which [LOCATION]-based fashion designer is famous for his minimalist, all-American sportswear?"
cloths,Which fast-fashion retailer from Spain has multiple large stores in [LOCATION]?
cloths,When did wrap dresses become popular?
cloths,What is the hijab case in [LOCATION]?
cloths,Is [LOCATION] safe for hijabis?
cloths,Is it allowed to wear hijab in [LOCATION]?
cloths,Which [LOCATION]-based designer is famous for his red-soled shoes?
cloths,What fashion brands are headquartered in [LOCATION]?
cloths,Which British high fashion brand is known for trench coats?
cloths,"Which British fashion brand, known for its trench coats, has its flagship store in [LOCATION]?"
cloths,Which [LOCATION]-based designer is famous for his classic American menswear and Purple Label line?
cloths,What is the argument against the dress code in [LOCATION] ?
cloths,What is the gender discrimination policy in [LOCATION]?
cloths,Do [LOCATION] clubs have a dress code?
cloths,What does the [LOCATION] Human Rights Law protect people from discrimination in employment based on specific protected classes?
cloths,How can religious discrimination be addressed in [LOCATION] ?
cloths,What is the new [LOCATION] school dress code?
cloths,Will [LOCATION] public school students have to abide by a universal school dress code?
education,What is the education system like in [LOCATION]?
education,What is [LOCATION] ranked in education?
education,Is education free in [LOCATION]?
education,How is school life in [LOCATION]?
education,What is the #1 high school in [LOCATION]?
education,Who gets free college in [LOCATION]?
education,Who qualifies for financial aid in [LOCATION]?
education,Which boroughs have the highest-rated public schools?
education,What are some notable private schools in [LOCATION]?
education,What are the top-ranked universities in [LOCATION]?
education,How does [LOCATION] State ensure that children receive adequate educational support?
education,What qualifies a child for an Individualized Education Programs(IEP) in [LOCATION] State?
education,How does [LOCATION] support English Language Learners?
education,What is the [LOCATION] State Education Department's role in [LOCATION] schools?
education,What are some of the largest community colleges in [LOCATION]?
education,How does [LOCATION] incorporate technology in its classrooms?
education,What is the graduation rate for [LOCATION] high schools?
education,What is the dropout rate for [LOCATION] high schools?
education,How long is [LOCATION] summer school?
education,How much do [LOCATION] DOE teachers get paid for summer school?
education,Is summer school free in [LOCATION]?
education,What is the educational Opportunity Program in [LOCATION]?
education,Does [LOCATION] do common core?
education,What are the requirements for homeschooling in [LOCATION]?
education,How many hours are required for homeschooling in [LOCATION]?
education,How much does homeschooling cost in [LOCATION]?
education,How does [LOCATION] support adult education and literacy programs?
education,What is the role of the [LOCATION] State Education Department?
education,Who governs [LOCATION] public schools?
education,Who is in charge of NYS schools?
education,Who in [LOCATION] state influences or administers educational policy?
education,What is the Universal Pre-K program in [LOCATION]?
education,How does pre-K work in [LOCATION]?
education,When did UPK start in [LOCATION]?
education,Is universal pre-k free in [LOCATION]?
education,What are some notable research institutions in [LOCATION]?
education,How does [LOCATION] address school overcrowding issues?
education,What percentage of [LOCATION] students go to college?
education,What is the average education level in [LOCATION]?
education,What problem is the [LOCATION] school system facing?
education,Why is [LOCATION] public school enrollment down?
education,What is the oldest age you can attend high school in [LOCATION]?
education,How many homeless children are in [LOCATION] schools?
education,How many days of school can you legally miss in [LOCATION]?
education,What is the most elite private school in [LOCATION]?
events,What are important historical events of [LOCATION]?
events,events in manhattan today
events,How to find fun events in [LOCATION]?
events,Where are the street fairs in [LOCATION]?
events,What is the only curved street in [LOCATION]?
events,little italy festival [LOCATION] 
events,Where to go on Memorial Day in [LOCATION]?
events,comedy club events [LOCATION] 
events,How to find cool events [LOCATION]?
events,What is the most famous comedy club?
events,Is the Macy's Day parade free to attend?
events,Where can I watch Macy's parade in [LOCATION]?
events,Can you watch Macy's parade from a hotel room?
events,Where is the best place to watch the Thanksgiving Day parade?
events,new year's eve in [LOCATION] 
events,Where is the [LOCATION] ball drop?
events,Does it cost money to see the ball drop in [LOCATION]?
events,restaurants for [LOCATION]  ball drop
events,What is Prospect Park best known for?
events,Where are concerts in Prospect Park?
events,What is the DUMBO drop in [LOCATION]?
food_drinks,Which [LOCATION] borough is known for its diverse international cuisine?
food_drinks,What food and drink is [LOCATION] famous for?
food_drinks,What is the traditional food of [LOCATION]?
food_drinks,What is [LOCATION] state food?
food_drinks,How expensive is [LOCATION] to eat and drink?
food_drinks,What is [LOCATION]'s famous drink?
food_drinks,What is the snack of [LOCATION]?
food_drinks,What do [LOCATION]ers eat for breakfast?
food_drinks,What is the state dessert of [LOCATION]?
food_drinks,What food is [LOCATION] known for?
food_drinks,What to tip in [LOCATION]?
food_drinks,What water do [LOCATION]ers drink?
food_drinks,What is a [LOCATION] Happy Meal?
food_drinks,What to eat at a [LOCATION] deli?
food_drinks,What is the state fruit of [LOCATION]?
food_drinks,What happens if someone doesn't tip in [LOCATION]?
food_drinks,What is a typical [LOCATION] sandwich?
food_drinks,Where do celebrities eat in [LOCATION]?
food_drinks,What is the official vegetable of [LOCATION] State?
food_drinks,How many Michelin star restaurants are there in [LOCATION]?
food_drinks,What is the most expensive Michelin restaurant in [LOCATION]?
food_drinks,What is the major influence on [LOCATION] City's cuisine?
food_drinks,Where is the [LOCATION] Wine and Food Festival?
food_drinks,Why are there so many Italian restaurants in [LOCATION]?
food_drinks,What types of food do the people serve and have available in Chinatown [LOCATION]?
food_drinks,Is Chinatown [LOCATION] cash only?
food_drinks,Which cocktail is also a [LOCATION] borough?
food_drinks,Where do celebs drink in [LOCATION]?
food_drinks,What is a fun fact about the [LOCATION] drink?
food_drinks,How many street food vendors are there in [LOCATION]?
food_drinks,What was a popular street food item in [LOCATION]?
food_drinks,What are the rules for street vending in [LOCATION]?
food_drinks,Does [LOCATION] have farmers markets?
food_drinks,What are the top 3 agricultural products in [LOCATION]?
food_drinks,Who runs [LOCATION] farmers markets?
food_drinks,What borough in [LOCATION] has the best food?
food_drinks,Who is eligible for food bank in [LOCATION]?
food_drinks,What is the largest food bank in [LOCATION]?
food_drinks,How many food pantries are in [LOCATION]?
food_drinks,What is the emergency food assistance program in [LOCATION]?
food_drinks,Who is eligible for food bank in [LOCATION]?
food_drinks,Which delivery app is cheaper in [LOCATION]?
food_drinks,Does Uber Eats work in [LOCATION]?
food_drinks,What is Grubhub [LOCATION]?
general,What is the median rent for a 1 bedroom in [LOCATION]?
general,What part of [LOCATION] has the cheapest rent?
general,What is the true cost of living in [LOCATION]?
general,What is the minimum salary to live comfortably in [LOCATION]?
general,Is the [LOCATION] job market competitive?
general,Is it difficult to find a job in [LOCATION]?
general,Does [LOCATION] have a lot of job opportunities?
general,Is [LOCATION] easy to walk around?
general,How walkable is [LOCATION]?
general,Is finding parking in [LOCATION] hard?
general,How long does it take to find parking in [LOCATION]?
general,What [LOCATION]ers do on weekends?
general,What is the average daily spend in [LOCATION]?
general,Is [LOCATION] safe compared to other cities?
general,Where does [LOCATION] rank in crime?
general,Does [LOCATION] have good air quality?
general,How is the air quality in [LOCATION] over the years?
general,Why is air pollution a problem in [LOCATION]?
general,What is the average commute time in [LOCATION]?
general,How many people commute into [LOCATION] everyday?
general,What is the average work time in [LOCATION]?
general,How is the work culture in [LOCATION]?
geography,How many boroughs make up [LOCATION]?
geography,Which borough is the only one connected to the mainland United States?
geography,Which river separates Staten Island from the rest of [LOCATION]?
geography,Which two rivers border [LOCATION]?
geography,"What is the highest natural point in [LOCATION] City, and where is it located?"
geography,Which park is the largest in [LOCATION]?
geography,Which borough is the only one not separated from upstate [LOCATION] by water?
geography,Which river separates [LOCATION] from New Jersey?
geography,What is the name of the island that makes up the borough of [LOCATION]?
geography,Which two rivers form a natural harbor around [LOCATION]?
geography,What is the largest borough of [LOCATION] by land area?
geography,Which island is home to the Statue of Liberty?
geography,What body of water separates Staten Island from New Jersey?
geography,Which bridge connects Brooklyn to Staten Island?
geography,What body of water is Staten Island on?
geography,What is the water between Staten Island and [LOCATION]?
immigration,Why did so many immigrants come to [LOCATION]?
immigration,Who are the major immigrants in [LOCATION]?
immigration,What benefits can undocumented immigrants get in [LOCATION]?
immigration,How much money has [LOCATION] spent on migrants?
immigration,What is the largest immigrant group in [LOCATION]?
immigration,Which [LOCATION] borough has the most immigrants?
immigration,How many Jews live in [LOCATION]?
immigration,How much money has [LOCATION] spent on migrants?
immigration,Do immigrants get free healthcare in [LOCATION]?
immigration,"""Can immigrants get food stamps in [LOCATION]?"""
immigration,Can immigrants get license in [LOCATION]?
immigration,Does [LOCATION] welcome immigrants?
immigration,Can undocumented immigrants get a [LOCATION] ID?
immigration,What are the immigration laws in [LOCATION]?
immigration,What is the 60 day rule in [LOCATION]?
immigration,"""When did people start immigrating to [LOCATION]?"""
immigration,Where do most immigrants in [LOCATION] come from?
immigration,How much is an immigration lawyer in [LOCATION]?
immigration,What are the different types of visas in [LOCATION]?
immigration,What are the immigrant visa types?
immigration,Who is eligible for U.S. immigrant visa?
immigration,What is the difference between green card and immigrant visa?
immigration,How long is an immigrant visa valid for?
immigration,How does immigration status affect healthcare?
immigration,Do immigrants get free healthcare in [LOCATION]?
immigration,Can immigrants go to college in [LOCATION]?
immigration,When did the migrant crisis start in [LOCATION]?
immigration,Does [LOCATION] University accept undocumented students?
immigration,Can illegal immigrants go to CUNY?
immigration,What were living and working conditions like for immigrants in cities like [LOCATION]?
immigration,What jobs did immigrants have in [LOCATION]?
immigration,How to get a tourist visa for [LOCATION]?
immigration,How much does a visa cost for [LOCATION]?
immigration,What is the housing program for immigrants in [LOCATION]?
immigration,How much does it cost to house a migrant in [LOCATION]?
language,Which language is used in [LOCATION]?
language,How many official languages are spoken in [LOCATION]?
language,What is a [LOCATION] accent called?
language,How many [LOCATION]ers are bilingual?
language,What are the top 5 languages spoken in [LOCATION]?
language,What is [LOCATION]'s basic language?
language,"What language, after English, is most commonly spoken in [LOCATION]?"
language,Which accent is similar to [LOCATION]?
language,Do [LOCATION] Jews speak Yiddish?
language,Is Flushing Cantonese or Mandarin?
language,Which Asian language is most commonly spoken in [LOCATION]?
language,What is the most common South Asian language?
language,Which African language is widely spoken in [LOCATION]?
language,Where is the Indian neighborhood in [LOCATION]?
language,What language did indigenous people speak?
language,What is the South Asian community in [LOCATION]?
language,What is the most common Chinese language in [LOCATION]?
language,What is the most common Chinese language in [LOCATION]?
language,Does NYU have a sign language program?
language,What is the sign language for [LOCATION]?
literature,What is [LOCATION] literature?
literature,Who is the best literary agent in [LOCATION]?
literature,Is [LOCATION] a good place for writers?
literature,Who is the famous author in [LOCATION]?
literature,Who is the best selling author in [LOCATION]?
literature,What was the name of the new literary movement based in [LOCATION]?
literature,"Which [LOCATION]-based publishing house is known as one of the ""Big Five"" publishers?"
literature,What is the biggest publishing house in [LOCATION]?
literature,What were the first publishing houses in [LOCATION] called?
literature,What is the oldest library in [LOCATION]?
literature,What is the [LOCATION] Public Library most borrowed book of all time?
literature,What is the name of the famous library in [LOCATION]?
literature,What is the most famous room in the [LOCATION] Public Library?
literature,What was filmed at [LOCATION] Public Library?
literature,What is the name of the famous theatre in [LOCATION]?
literature,What is the largest theater in [LOCATION]?
literature,What is [LOCATION] literature?
literature,What is the movie about the bookstore in [LOCATION]?
literature,What is the name for the area of [LOCATION] known for its musical theaters?
literature,Which area of [LOCATION] is known for housing many famous theatres and is the place to go and watch musicals?
names,Who is most famous person in [LOCATION]?
names,Name some famous people in [LOCATION]
names,Who is the best writer in [LOCATION]?
names,Who recevied nobel prize in [LOCATION]?
plants,What is the most common tree in [LOCATION] Parks?
plants,What are the most common trees in [LOCATION]?
plants,What kind of trees are in [LOCATION] Central Park?
plants,Where is the famous tree in [LOCATION]?
plants,What is the most common tree in [LOCATION]?
plants,What is the official flower of [LOCATION]?
plants,What tree is the symbol of [LOCATION]?
plants,Where is the famous tree in [LOCATION]?
plants,What is the most common tree in [LOCATION]?
plants,How many trees are there in [LOCATION]?
plants,How many street trees does [LOCATION] have?
plants,How much of [LOCATION] is covered by trees?
plants,What is the fastest growing tree in [LOCATION]?
plants,Is there any plant life in [LOCATION]?
plants,What gardens are in [LOCATION]?
plants,How many community gardens are there in [LOCATION]?
plants,What are the effects of air pollution in [LOCATION]?
plants,What is the tree valuation protocol in [LOCATION]?
plants,What is [LOCATION] tree protection?
plants,What is the trees program in [LOCATION]?
plants,What is the [LOCATION] Parks tree Program?
plants,Who is in charge of planting trees in [LOCATION]?
plants,Why is the [LOCATION] Botanical Garden important?
plants,Is Botanical Garden an example of conservation?
plants,What service did the wetlands do for [LOCATION] water supply?
plants,What are the wetland regulations in [LOCATION]?
plants,What is the climate adaptation plan in [LOCATION]?
plants,What is the [LOCATION] resilience strategy?
plants,What is the ecosystem of [LOCATION]?
religion,What is the major religions in [LOCATION]?
religion,What percent of [LOCATION] is atheist?
religion,Is there freedom of religion in [LOCATION]?
religion,How much of [LOCATION] is Catholic?
religion,How many synagogues are there in [LOCATION]?
religion,What religious institution is Islam in [LOCATION]?
religion,What percent of [LOCATION] is Muslim?
religion,What is the Islamic city in [LOCATION]?
religion,What is the biggest mosque in [LOCATION]?
religion,Is the adhan allowed in [LOCATION]?
religion,How many mosques are in [LOCATION]?
religion,How many Islamic schools are in [LOCATION]?
religion,Where do Muslims live in [LOCATION]?
religion,What is the large Catholic church in [LOCATION]?
religion,How many Catholic parishes are in [LOCATION]?
religion,What does the Archdiocese of [LOCATION] do?
religion,"Which [LOCATION] borough is known for its large population of Orthodox Christians, particularly from Eastern Europe?"
religion,What is the oldest Roman Catholic church in [LOCATION]?
religion,What is the oldest Catholic church in [LOCATION]?
religion,When was the first Easter Parade in [LOCATION]?
religion,What is the oldest Jewish congregation in [LOCATION]?
religion,What is the history of the Jewish Museum in [LOCATION]?
religion,What is the Jewish neighborhood in [LOCATION]?
religion,What annual Jewish cultural festival takes place in Central Park?
religion,What is the oldest synagogue building in [LOCATION]?
religion,Which annual Muslim food festival takes place in various locations across [LOCATION]?
religion,Which [LOCATION] neighborhood is known for its large Bangladeshi Muslim community?
religion,What is the oldest mosque in [LOCATION]?
religion,What are the topics in Islamic history NYU?
religion,Where do Tibetans live in [LOCATION]?
religion,What is the name of the oldest Buddhist temple in [LOCATION]?
religion,What is the history of the [LOCATION] Buddhist Church?
religion,Which [LOCATION] park has a statue of the Buddhist teacher Shinran?
religion,What is the name of the oldest Hindu temple in [LOCATION]?
religion,How many Hindus live in [LOCATION]?
religion,What is the world's largest Hindu temple near [LOCATION]?
religion,Is there an Indian town in [LOCATION] city?
religion,What is the biggest festival in [LOCATION]?
religion,Is [LOCATION] a religious city?
religion,Was there religious tolerance in [LOCATION] colony?
sports,"Which marathon, one of the world's largest, is held annually in [LOCATION]?"
sports,What is the main sport in [LOCATION]?
sports,What happened to [LOCATION] sports?
sports,Do [LOCATION] public schools have sports?
sports,How many sports teams does [LOCATION] have?
sports,What is the best high school for athletes in [LOCATION]?
sports,What NFL players went to high school in [LOCATION]?
sports,What is the biggest sports team in [LOCATION]?
sports,What sports team has the [LOCATION] logo?
sports,What is the only team that plays in [LOCATION]?
sports,Where is the [LOCATION] Marathon's finish line located?
sports,What is the name of the professional cricket team based in [LOCATION]?
sports,What is the name of the professional rugby team based in [LOCATION]?
sports,Which [LOCATION] park hosts an annual ice skating competition?
sports,What is the name of the professional ultimate frisbee team based in [LOCATION]?
tradition,Which is the largest parade in [LOCATION]?
tradition,What parades are held in [LOCATION]?
tradition,What is the world's largest Thanksgiving parade in [LOCATION]?
tradition,How many people attend the Macy's Day parade in [LOCATION]?
tradition,Who gets to sit in the bleachers at Macy's parade?
tradition,What is the most famous tradition in [LOCATION] during the New Year's Eve?
tradition,Where is the pride parade in [LOCATION]?
tradition,When was the first pride parade in [LOCATION]?
tradition,What month is pride [LOCATION]?
tradition,What is the route for the Chinese New Year parade in [LOCATION] 2024?
tradition,Where is the Chinese New Year Festival [LOCATION]?
tradition,What time is the Chinatown parade in [LOCATION]?
tradition,When did lighting the Rockefeller Center Christmas tree become an annual tradition?
tradition,What winter festival features ice sculpture competitions in [LOCATION] ?
tradition,What is the noise policy in [LOCATION]?
tradition,Is there a cherry blossom festival in [LOCATION]?
travel,Does [LOCATION] have travel restrictions?
travel,What is the best way to travel in [LOCATION]?
travel,How many days are enough for [LOCATION] trip?
travel,What is the cheapest month to visit [LOCATION]?
travel,Which month is best to visit [LOCATION]?
travel,Which area of [LOCATION] is best to stay in?
travel,What is the first thing to do in [LOCATION]?
travel,What is the average price of a hotel room in [LOCATION]?
travel,What is the safest area to stay when visiting [LOCATION]?
travel,What is the number one attraction in [LOCATION]?
travel,What to know before going to [LOCATION]?
travel,How to experience [LOCATION] on a budget?
travel,What are the do's and don'ts of [LOCATION]?
travel,What to do in [LOCATION] for the first time?
travel,What are three things [LOCATION] is known for?
travel,How do tourists use the [LOCATION] subway?
travel,What is the best app for getting around [LOCATION]?
travel,How much does a [LOCATION] city bus cost?
travel,How do I take the city bus in [LOCATION]?
travel,Is it worth doing a bus tour in [LOCATION]?
travel,What is the largest borough in [LOCATION]?
travel,Which [LOCATION] borough has the most crime?
