topic,query
travel,What is the safest borough to live in [LOCATION]?
travel,What is the most visited monument in [LOCATION]?
travel,What are some popular shopping areas in [LOCATION]?
travel,What is the most famous shopping Centre in [LOCATION]?
travel,What is the skyline in [LOCATION]?
travel,What is the largest skyscraper in [LOCATION]?
travel,What are some scenic spots to get the best views of the [LOCATION] skyline?
travel,What are the best museums in [LOCATION]?
travel,Which Museum is free in [LOCATION]?
travel,Are there any annual events or festivals in [LOCATION] that are worth planning a trip around?
travel,Can anyone visit [LOCATION] Public Library?
travel,Which [LOCATION] borough has the most homeless?
travel,Which part of [LOCATION] became famous as a vibrant African American community?
travel,Where do most Italians live in [LOCATION]?
travel,Does [LOCATION] have beaches?
travel,What is the nicest beach in [LOCATION]?
travel,What is the closest beach town to [LOCATION]?
travel,What beach in [LOCATION] has clear water?
travel,What is the biggest zoo in [LOCATION]?
travel,What is the average price of Airbnb in [LOCATION]?
travel,Where are the Brazilians in [LOCATION]?
weather,Why is [LOCATION] so humid?
weather,What is the coldest month in [LOCATION]?
weather,Which month is generally the rainiest in [LOCATION]?
weather,What is the average temperature in [LOCATION] during the summer months?
weather,Which month typically sees the highest temperatures in [LOCATION]?
weather,When does autumn typically begin in [LOCATION]?
weather,What natural phenomenon attracts tourists to Central Park in autumn?
weather,Which month usually marks the first snowfall in [LOCATION]?
weather,What is the average annual snowfall in [LOCATION]?
weather,How hot will [LOCATION] be in 2050?
weather,Is [LOCATION] cold in the fall?
weather,How hot does [LOCATION] get in summer?
weather,What is the Weather like in [LOCATION] over summer?
weather,Which month is generally the rainiest in [LOCATION]?
weather,What is the average number of rainy days per year in [LOCATION]?
weather,How does the proximity to the Atlantic Ocean influence [LOCATION]'s climate?
weather,What is the average temperature in [LOCATION] during winter months?
weather,How do [LOCATION]'s skyscrapers affect wind patterns in the city?
weather,How does snow removal work in [LOCATION]?
weather,What measures has [LOCATION] taken to prepare for climate change and rising sea levels?
weather,How is [LOCATION] preparing for climate change?
weather,How is [LOCATION] becoming more sustainable?
weather,How do they plow snow in [LOCATION] city?
weather,Who is responsible for snow removal in [LOCATION]?
weather,How much does [LOCATION] pay for snow removal?
weather,Do [LOCATION] skyscrapers sway in the wind?
weather,What is the wind tunnel effect in [LOCATION]?
weather,Are there wind tunnels in [LOCATION]?
weather,How does the ocean affect [LOCATION]?
weather,What ocean is closest to [LOCATION]?
weather,What is causing the climate change in [LOCATION]?
animal,National bird of [LOCATION]
animal,what is the national animal of [LOCATION]
animal,most common wildlife species of [LOCATION]
animal,major wildlife protection laws in [LOCATION]
animal,How does deforestation impact wildlife in [LOCATION]?
animal,What are the main wildlife sanctuaries and national parks in [LOCATION]?
animal,national zoo of [LOCATION]
animal,What are the common bird species found in [LOCATION]?
animal,How is the population of freshwater dolphins in [LOCATION]'s rivers being protected?
animal,How does the government of [LOCATION] regulate illegal wildlife trade?
animal,What are the traditional uses of animals in [LOCATION]i culture?
animal,How does urbanization affect animal habitats in [LOCATION]?
animal,What are the main migratory bird routes that pass through [LOCATION]?
animal,How effective are the wildlife protection laws in [LOCATION]?
animal,What are the major reptile species found in [LOCATION]?
animal,How do community-based conservation projects work in [LOCATION]?
animal,types of marine animals are commonly found off the coast of [LOCATION]
animal,"How do natural disasters, like cyclones, affect wildlife in [LOCATION]?"
animal,What is the status of the Asian elephant population in [LOCATION]?
animal,How is the biodiversity of [LOCATION]'s wetlands being preserved?
animal,How can citizens contribute to wildlife conservation efforts in [LOCATION]?
animal,main institutions conducting wildlife research in [LOCATION]
animal,What are the primary habitats supporting wildlife in [LOCATION]?
animal,What are the significant insect species in [LOCATION]?
animal,what is the role of insects in [LOCATION]i ecosystem?
animal,How does traditional [LOCATION]i culture view and interact with wildlife?
animal,What are the common human-wildlife conflicts in [LOCATION]?
animal,What are the most notable bird species in [LOCATION]?
animal,What are some endemic species unique to [LOCATION]?
animal,major endangered species in [LOCATION]
animal,how national parks are helping in the conservation of animals in [LOCATION]
animal,importance of wetland ecosystems for bird species
animal,types of Mammals found in [LOCATION]
animal,most common domestic animals of [LOCATION]
animal,How important are cattle to the agricultural economy of [LOCATION]?
animal,What are the traditional practices for raising poultry in rural [LOCATION]?
animal,common breeds of cattle and buffalo found in [LOCATION]
animal,How does the government support livestock farming in [LOCATION]?
animal,How do domestic animals contribute to the livelihoods of [LOCATION]i people?
animal,What are the primary health issues faced by domestic animals in [LOCATION]?
animal,How is veterinary care provided to domestic animals in rural areas of [LOCATION]?
animal,famous veterinary care centre for pet in [LOCATION]
animal,How is dairy farming developing in [LOCATION]?
animal,common practices for feeding domestic animals in [LOCATION]
business,key industries driving economic growth in [LOCATION]
business,How is the government of [LOCATION] supporting small and medium-sized enterprises (SMEs)?
business,demand of organic food business in [LOCATION]
business,which is the most profitable business in [LOCATION]?
business,diversity of food business in [LOCATION]
business,what are the main challenges of business in [LOCATION]
business,what are the rules and regulation to established a  startup business in [LOCATION]?
business,What are the main challenges facing foreign investors in [LOCATION]?
business,emerging sectors for business opportunities in [LOCATION]
business,How does the legal and regulatory framework affect business operations in [LOCATION]?
business,What are the tax incentives available for businesses in [LOCATION]?
business,How is the startup ecosystem developing in [LOCATION]?
business,major export products of [LOCATION]
business,which countries are the main trading partners of [LOCATION]?
business,How does the banking and financial sector support business growth in [LOCATION]?
business,trends in e-commerce and digital business in [LOCATION]
business,How does the infrastructure in [LOCATION] support business activities?
business,What are the key factors influencing the business environment in [LOCATION]?
business,How is the tourism industry contributing to [LOCATION]’s economy?
business,What are the best practices for setting up a business in [LOCATION]?
business,How does the labor market in [LOCATION] affect business operations?
business,What role do trade agreements play in [LOCATION]'s business landscape?
business,How is [LOCATION] addressing environmental sustainability in its business practices?
business,What are the legal requirements to start a business in [LOCATION]?
business,How do I register a new company in [LOCATION]?
business,most promising industries for new businesses in [LOCATION]
business,How can one obtain financing for a startup in [LOCATION]?
business,What are the key challenges for foreign businesses entering the [LOCATION]i market?
business,How do I find reliable suppliers and partners in [LOCATION]?
business,What are the best practices for hiring employees in [LOCATION]?
business,import and export regulations in [LOCATION]
business,What are the local marketing strategies that work well in [LOCATION]?
business,What are the popular e-commerce platforms in [LOCATION]?
business,current size of the e-commerce market in [LOCATION]
business,What payment gateways are commonly used in [LOCATION]i e-commerce?
business,What are the main challenges facing e-commerce entrepreneurs in [LOCATION]?
business,How is mobile commerce (m-commerce) developing in [LOCATION]?
business,How do I start an e-commerce business in [LOCATION]?
cloths,Men's traditional clothing in [LOCATION]
cloths,Popular men's fashion trends in [LOCATION]
cloths,Traditional [LOCATION]i women's clothing styles
cloths,Where to buy traditional [LOCATION]i men's clothing online?
cloths,Best places to shop for men's clothing in [LOCATION]
cloths,who is the best designer of [LOCATION]
cloths,men's formal wear in [LOCATION]
cloths,Affordable men's clothing stores in [LOCATION]
cloths,Men's wedding attire in [LOCATION]
cloths,who are the fashion influencer in [LOCATION]?
cloths,Trending men's fashion brands in [LOCATION]
cloths,men's summer clothing styles in [LOCATION]
cloths,Where to find high-quality men's shirts in [LOCATION]?
cloths,Men's fashion boutiques in [LOCATION]
cloths,men's casual wear shops in [LOCATION]
cloths,Best places to buy jeans for men in [LOCATION]
cloths,Online shopping platforms fo clothing in [LOCATION]
cloths,Latest trends in women's fashion in [LOCATION]
cloths,women's wedding attire in [LOCATION]
cloths,women's best clothing brands in [LOCATION]
cloths,Dress code for public sector employees in [LOCATION]
cloths,Corporate dress code for women in [LOCATION]
cloths,Dress code for attending a cultural event in [LOCATION]
cloths,School uniform policies in [LOCATION]
cloths,what are the appropriate clothing in terms of fashion for youth of [LOCATION]?
cloths,Children's clothing during summer
cloths,demand of Woolen clothes in winter
cloths,Demand for cotton fabric for all season
cloths,What is the amount of money required to set up Garments in [LOCATION]?
education,education system in [LOCATION]
education,[LOCATION] literacy rate
education,average education cost in [LOCATION]
education,rank of [LOCATION] in education
education,[LOCATION]'s new Education Minister
education,challenges of education system in [LOCATION]
education,Primary School curriculum
education,secondary education grading system in [LOCATION]
education,what is the timeline for admission process
education,which school provide transportation service in [LOCATION]
education,List of best medical college in [LOCATION]
education,the best engineering universities of [LOCATION]
education,best public Universities of [LOCATION]
education,Best private Universities of [LOCATION]
education,is it worthy to study in a private University
education,which division has most literacy rete in [LOCATION]
education,what is the process for admission transfer student from other school
education,does school handle health emergencies in [LOCATION]
education,does school have medical facilities on campus in [LOCATION]
education,Best schools for special child in [LOCATION]
education,what is the highest level of education in [LOCATION]
education,Right age to enroll a child in school
education,requirements to apply in university in [LOCATION] 
education,Demand for technical education on the job sector
education,what is the compulsory level of education in [LOCATION]
education,Government scholarship for science and technology education
education,what are the challenges in rural level education
events,victory day of [LOCATION]
events,National Independence Day
events,[LOCATION] International Film festival
events,[LOCATION] lit fest
events,National Art Exhibition of [LOCATION]
events,Handicrafts Fair in [LOCATION]
events,biggest cultural festival in [LOCATION]
events,celebration of moonson festival in [LOCATION]
events,concert in [LOCATION]
events,what is the most popular festival for the youth of [LOCATION]
events,What are the main muslim religious festival of [LOCATION]
events,[LOCATION] tourism fair
events,[LOCATION] national tree fair
events,celebration of [LOCATION] trade fair
events,National Mourning day of [LOCATION]
events,agriculture fair of [LOCATION]
events,festival of [LOCATION] in winter
events,celebration of new year in [LOCATION]
events,why people criticize Digital Security Act in [LOCATION]
events,Climate Change Policies
events,Economic Development Initiatives
events,election of [LOCATION]
events,heatwave alerts in [LOCATION]
events,Inflation and Currency Challenges of [LOCATION]
events,update of GDP growth and forecasts
food_drinks,most popular traditional dishes in [LOCATION]
food_drinks,what are the staple foods in [LOCATION]
food_drinks,what is [LOCATION]'s national dish
food_drinks,what is [LOCATION]'s national fruit
food_drinks,some common ingredients used in cooking
food_drinks,What are the special sweets for [LOCATION] people make for celebrations
food_drinks,most popular street food in [LOCATION]
food_drinks,What are the main regional cuisines in [LOCATION]
food_drinks,list of restaurants someone can find best desserts in [LOCATION]
food_drinks,Does cooking preserve nutrition value in [LOCATION]
food_drinks,Does food reflex its cultural heritage in [LOCATION]
food_drinks,why Italian pizza pasta are getting popular in [LOCATION]?
food_drinks,what are the most popular drink in [LOCATION]?
food_drinks,what are the popular modern drinks in [LOCATION]
food_drinks,what are the popular cold beverage in [LOCATION] during summer
food_drinks,popular hot benerage during winter
food_drinks,must try Street beverage in [LOCATION]
food_drinks,What are the traditional alcoholic beverages in [LOCATION]?
food_drinks,list of common harmful force in [LOCATION]
food_drinks,most popular dishes of [LOCATION] are renowned internationally
food_drinks,common European food in [LOCATION]
food_drinks,famous Arabic restaurant in [LOCATION]
food_drinks,best Chinese restaurant in [LOCATION]
food_drinks,most luxurious restaurants in [LOCATION]
food_drinks,most popular Beef recipe in [LOCATION]
general,How is [LOCATION] addressing political dissent and freedom of speech issues?
general,recent developments regarding human rights in [LOCATION]
general,regional politics influence national politics in [LOCATION]
general,role of the military in [LOCATION]i politics today
general,How does corruption affect politics in [LOCATION]?
general,What are the key political reforms being proposed in [LOCATION]?
general,How has political activism evolved in [LOCATION] in recent years?
general,current challenges to democracy in [LOCATION]
general,How does the political climate in [LOCATION] impact foreign relations?
general,What are the major political issues facing [LOCATION] in recent time?
general,How has the political landscape in [LOCATION] changed since the last general election?
general,What are the main political parties in [LOCATION] and their current standings?
general,recent flood news of [LOCATION]
general,"What caused the recent fire at the [LOCATION] shopping mall, and what were the casualties?"
general,What is the current situation regarding human rights abuses in [LOCATION]?
general,recent developments in the healthcare sector in [LOCATION]
general,How does Government of [LOCATION] help flood affected people?
general,economic growth in [LOCATION]
general,How has the COVID-19 pandemic affected [LOCATION]'s economy?
general,digital economy in [LOCATION]
general,agricultural sector in [LOCATION]
general,What are the recent trends in inflation and unemployment rates in [LOCATION]?
geography,What is the geometric shape of [LOCATION]?
geography,How do rivers influence the geometry of [LOCATION]?
geography,What are the major geographical regions of [LOCATION]?
geography,What are the highest and lowest points in [LOCATION]?
geography,monsoon seasons of [LOCATION]
geography,How does [LOCATION]'s location affect its climate?
geography,major islands of [LOCATION]
geography,How does river erosion shape the landscape of [LOCATION]?
geography,What are the primary natural resources found in [LOCATION]?
geography,deforestation affect
geography,What are the major landforms in [LOCATION]?
geography,What are the geographic challenges posed by climate change in [LOCATION]?
geography,How is the geography of [LOCATION] linked to its agricultural practices?
geography,What geographic factors contribute to flooding in [LOCATION]?
geography,how coastal regions of [LOCATION] differ from the inland areas?
geography,How does urbanization affect the geographic landscape of [LOCATION]?
geography,What are the major environmental issues of [LOCATION]?
geography,How do the different soil types in [LOCATION] affect agriculture?
geography,What is the geographic distribution of forests in [LOCATION]?
geography,How does [LOCATION]'s geography influence its cultural diversity?
geography,What role do wetlands play in the geography of [LOCATION]?
geography,What are the key geographic factors affecting transportation in [LOCATION]?
geography,How does the geography of [LOCATION] contribute to its vulnerability to natural disasters?
geography,major geographical changes occurring in [LOCATION] due to sea level rise
geography,How does the geography of [LOCATION] affect its tourism industry?
immigration,What are the visa requirements for entering [LOCATION]?
immigration,How can I apply for a tourist visa to [LOCATION]?
immigration,What documents are needed for a work visa in [LOCATION]?
immigration,How long does it take to process a [LOCATION] visa?
immigration,Can I extend my tourist visa while in [LOCATION]?
immigration,process for obtaining permanent residency in [LOCATION]
immigration,How can I apply for citizenship of [LOCATION]?
immigration,What are the eligibility criteria for citizenship of [LOCATION]?
immigration,How do I obtain a student visa for studying in [LOCATION]?
immigration,What are the fees associated with applying for a visa to [LOCATION]?
immigration,Can I apply for a visa to [LOCATION] online?
immigration,What is the process for renewing a work visa in [LOCATION]?
immigration,What are the requirements for a journalist visa in [LOCATION]?
immigration,What are the rules regarding dual citizenship in [LOCATION]?
immigration,How can a [LOCATION] citizen sponsor a family member for immigration?
immigration,What are the health requirements for immigrating to [LOCATION]?
immigration,How do I apply for a transit visa for [LOCATION]?
immigration,How long can I stay in [LOCATION] on a tourist visa?
immigration,What are the penalties for overstaying a visa in [LOCATION]?
immigration,How can I check the status of my visa application for [LOCATION]?
immigration,procedure for obtaining a spouse visa in [LOCATION]
immigration,Can foreign nationals own property in [LOCATION]?
immigration,What are the working rights of expatriates in [LOCATION]
immigration,How can I appeal a rejected visa application for [LOCATION]?
immigration,What are the requirements for a dependent visa in [LOCATION]?
immigration,How do I obtain a visa for attending a conference in [LOCATION]?
immigration,process for changing visa status in [LOCATION]
immigration,How do I report a lost or stolen visa while in [LOCATION]?
immigration,What are the residency requirements for naturalization in [LOCATION]?
immigration,Can I volunteer in [LOCATION] on a tourist visa?
immigration,requirements for a retirement visa in [LOCATION]
immigration,How do I obtain a multiple-entry visa for [LOCATION]?
immigration,What are the rules for international students working in [LOCATION]?
immigration,What are the travel restrictions and quarantine requirements for entering [LOCATION] during the COVID-19 pandemic?
immigration,How can a foreign national obtain a driver's license in [LOCATION]?
immigration,What are the customs regulations for bringing personal belongings into [LOCATION]?
immigration,How do I register with local authorities upon arrival in [LOCATION]?
immigration,What are the steps for renewing a residency permit in [LOCATION]?
immigration,How can I find legal assistance for immigration matters in [LOCATION]?
immigration,What are the specific visa requirements for citizens of India visiting [LOCATION]?
immigration,Can I start a business in [LOCATION] on a tourist visa?
immigration,What are the requirements for obtaining a visa on arrival in [LOCATION]?
immigration,How do I obtain a re-entry permit if I leave [LOCATION] temporarily?
immigration,What are the rules for importing pets into [LOCATION]?
immigration,How do I apply for a humanitarian visa in [LOCATION]?
immigration,What are the educational opportunities for expatriate children in [LOCATION]?
immigration,How can a refugee apply for asylum in [LOCATION]?
immigration,What are the options for obtaining health insurance as an expatriate in [LOCATION]?
immigration,What is the process for converting a tourist visa to a business visa in [LOCATION]?
immigration,process of visa cancelllation in [LOCATION]
immigration,how to get police clearance certificatein [LOCATION]?
immigration,How to get e passport in [LOCATION]?
language,What is the official language of [LOCATION]?
language,what is the second laguage of [LOCATION]?
language,Do the people [LOCATION] understand English Language?
language,best instituate to learn english in [LOCATION]
language,where can I learn germany in [LOCATION]?
language,what is the best institude to learn french in [LOCATION]?
language,what is the best mobile app to learn foreign language for [LOCATION] people?
language,where can I register for IELTS in [LOCATION]?
language,How does proficiency in English benefit individuals in terms of education and career opportunities in [LOCATION]?
language,How does English proficiency contribute to [LOCATION]'s competitiveness in the global economy?
language,How do English language skills contribute to technological advancements and innovation in [LOCATION]?
language,What are the language rights in [LOCATION]?
literature,Who are the most influential writers in [LOCATION] literature?
literature,major themes in [LOCATION] literature
literature,What are the notable literary movements in [LOCATION]?
literature,How does literature address social issues in [LOCATION]?
literature,What role does poetry play in [LOCATION] literature?
literature,Who are the prominent female writers in [LOCATION] literature?
literature,What are the major literary awards in [LOCATION]?
literature,How does [LOCATION] literature depict rural life?
literature,What is the impact of urbanization in [LOCATION] literature?
literature,Who are the notable novelists of [LOCATION]?
literature,How does [LOCATION] literature portray women's issues?
literature,role of translation in promoting [LOCATION] literature globally
literature,significant literary magazines in [LOCATION]
literature,history of [LOCATION]
literature,What are the major genres in [LOCATION] literature?
literature,How does [LOCATION] literature address environmental concerns?
literature,Who are the emerging writers in [LOCATION] literature recent time?
literature,How does [LOCATION] literature explore identity and cultural heritage?
literature,major literary festivals in [LOCATION]
literature,What role do literary societies play in [LOCATION]?
literature,What are the challenges faced by writers in [LOCATION]?
names,international airport of [LOCATION]
names,name 5 top most luxurious hotel of [LOCATION]
names,Biggest city of [LOCATION]
names,list of botanical parks in [LOCATION]
names,Famous shopping malls in [LOCATION]
names,richest peolple of [LOCATION]
names,who is the most popular person in [LOCATION]
plants,What is plant?
plants,Best indoor plants that are easy to grow
plants,The best time for tree plantation
plants,The worst time for tree plantation
plants,How to remove pests from plants organically
plants,which vitamin is good for flower plants?
plants,when to use fertilizer?
plants,is chemical fertilizer bad?
plants,why is my plant dying?
plants,rooftop gardening
plants,indoor gardening
plants,organic fertilizer benefits
plants,organic fertilizer usage
plants,why is plant important?
plants,forest land in [LOCATION]
plants,main types of timber-producing trees in [LOCATION]
plants,tree plantation program in [LOCATION]
plants,How do the coastal regions of [LOCATION] support unique plant species compared to inland areas?
plants,what types of fruit-bearing plants are commonly cultivated in [LOCATION]?
plants,what is the national fruit of [LOCATION]?
plants,How does the vegetation in the [LOCATION] adapt to urban environments?
plants,What types of ornamental plants are popular in the gardens of [LOCATION]?
plants,What are the dominant grass species found in the plain regions of [LOCATION]?
plants,What types of plants are typically found in the floodplains of [LOCATION]?
plants,traditional uses of plants in the rural areas
plants,uses of Aloe Vera plants
plants,medical use of ginger
plants,Ashwagandha helps to reduce stress
plants,use of Holy Basil plants
plants,Fenugreek helps to treat diabetes
plants,medicine use of Bitter Gourd
plants,"Turmeric plants used to treat skin conditions,"
plants,types of vegetables plants that we can easity grow in our yard
plants,domestic used of plants in [LOCATION]
religion,what is the main religious belief in [LOCATION]?
